{
  "script_id": "01002005",
  "title": "落花园",
  "correlations": [
    {
      "type": "character_theme",
      "strength": 1.0,
      "character_id": "c_邹云英",
      "character_name": "邹云英",
      "topic_id": 0,
      "topic_label": "其他情节",
      "evidence": "邹云英 台词与主题「其他情节」关键词重合度较高"
    },
    {
      "type": "character_theme",
      "strength": 0.9,
      "character_id": "c_陈杏元",
      "character_name": "陈杏元",
      "topic_id": 1,
      "topic_label": "才子佳人",
      "evidence": "陈杏元 台词与主题「才子佳人」关键词重合度较高"
    },
    {
      "type": "character_theme",
      "strength": 0.667,
      "character_id": "c_邹母",
      "character_name": "邹母",
      "topic_id": 0,
      "topic_label": "其他情节",
      "evidence": "邹母 台词与主题「其他情节」关键词重合度较高"
    },
    {
      "type": "character_theme",
      "strength": 0.333,
      "character_id": "c_丫鬟",
      "character_name": "丫鬟",
      "topic_id": 0,
      "topic_label": "其他情节",
      "evidence": "丫鬟 台词与主题「其他情节」关键词重合度较高"
    },
    {
      "type": "theme_narrative",
      "strength": 0.841,
      "topic_id": 0,
      "topic_label": "其他情节",
      "stage": "冲突",
      "evidence": "「冲突」段与全剧主导主题「其他情节」相对应"
    },
    {
      "type": "hangdang_narrative",
      "strength": 0.6,
      "hangdang": "青衣",
      "peak_block_index": 93,
      "evidence": "青衣 行当在 block 93 附近情感强度较高"
    },
    {
      "type": "character_network",
      "strength": 0.7,
      "character_id": "c_陈杏元",
      "character_name": "陈杏元",
      "evidence": "陈杏元 为关系网络核心（度=3）"
    }
  ],
  "summary_insights": [
    "《落花园》共 4 位主要人物、6 条关系边，网络密度 1.00。",
    "主题构成以「其他情节、才子佳人」为主。",
    "叙事划分为 5 个阶段，高潮位于 block [119, 123]。",
    "邹云英 与主题「其他情节」关联最强（1.0）。",
    "行当以青衣为主（2 人）。"
  ],
  "character_topic_matrix": [
    {
      "character_id": "c_邹云英",
      "character_name": "邹云英",
      "topic_id": 0,
      "topic_label": "其他情节",
      "strength": 1.0
    },
    {
      "character_id": "c_陈杏元",
      "character_name": "陈杏元",
      "topic_id": 1,
      "topic_label": "才子佳人",
      "strength": 0.9
    },
    {
      "character_id": "c_邹母",
      "character_name": "邹母",
      "topic_id": 0,
      "topic_label": "其他情节",
      "strength": 0.667
    },
    {
      "character_id": "c_丫鬟",
      "character_name": "丫鬟",
      "topic_id": 0,
      "topic_label": "其他情节",
      "strength": 0.333
    }
  ],
  "stage_network_snapshots": [
    {
      "stage": "铺垫",
      "block_range": [
        0,
        21
      ],
      "edge_density": 1.0,
      "node_count": 2,
      "edge_count": 1
    },
    {
      "stage": "发展",
      "block_range": [
        22,
        30
      ],
      "edge_density": 1.0,
      "node_count": 2,
      "edge_count": 1
    },
    {
      "stage": "冲突",
      "block_range": [
        31,
        118
      ],
      "edge_density": 1.0,
      "node_count": 3,
      "edge_count": 3
    },
    {
      "stage": "高潮",
      "block_range": [
        119,
        123
      ],
      "edge_density": 1.0,
      "node_count": 2,
      "edge_count": 1
    },
    {
      "stage": "结局",
      "block_range": [
        124,
        130
      ],
      "edge_density": 1.0,
      "node_count": 2,
      "edge_count": 1
    }
  ]
}
