{
  "script_id": "01001003",
  "title": "三娘教子",
  "correlations": [
    {
      "type": "character_theme",
      "strength": 1.0,
      "character_id": "c_薛保",
      "character_name": "薛保",
      "topic_id": 0,
      "topic_label": "家训教子",
      "evidence": "薛保 台词与主题「家训教子」关键词重合度较高"
    },
    {
      "type": "character_theme",
      "strength": 0.8,
      "character_id": "c_王春娥",
      "character_name": "王春娥",
      "topic_id": 0,
      "topic_label": "家训教子",
      "evidence": "王春娥 台词与主题「家训教子」关键词重合度较高"
    },
    {
      "type": "character_theme",
      "strength": 0.533,
      "character_id": "c_薛倚哥",
      "character_name": "薛倚哥",
      "topic_id": 0,
      "topic_label": "家训教子",
      "evidence": "薛倚哥 台词与主题「家训教子」关键词重合度较高"
    },
    {
      "type": "theme_narrative",
      "strength": 1.0,
      "topic_id": 0,
      "topic_label": "家训教子",
      "stage": "冲突",
      "evidence": "「冲突」段与全剧主导主题「家训教子」相对应"
    },
    {
      "type": "hangdang_narrative",
      "strength": 0.6,
      "hangdang": "青衣",
      "peak_block_index": 0,
      "evidence": "青衣 行当在 block 0 附近情感强度较高"
    },
    {
      "type": "character_network",
      "strength": 0.7,
      "character_id": "c_薛倚哥",
      "character_name": "薛倚哥",
      "evidence": "薛倚哥 为关系网络核心（度=2）"
    }
  ],
  "summary_insights": [
    "《三娘教子》共 3 位主要人物、3 条关系边，网络密度 1.00。",
    "主题构成以「家训教子」为主。",
    "叙事划分为 5 个阶段，高潮位于 block [76, 121]。",
    "薛保 与主题「家训教子」关联最强（1.0）。",
    "行当以小生为主（2 人）。"
  ],
  "character_topic_matrix": [
    {
      "character_id": "c_薛保",
      "character_name": "薛保",
      "topic_id": 0,
      "topic_label": "家训教子",
      "strength": 1.0
    },
    {
      "character_id": "c_王春娥",
      "character_name": "王春娥",
      "topic_id": 0,
      "topic_label": "家训教子",
      "strength": 0.8
    },
    {
      "character_id": "c_薛倚哥",
      "character_name": "薛倚哥",
      "topic_id": 0,
      "topic_label": "家训教子",
      "strength": 0.533
    }
  ],
  "stage_network_snapshots": [
    {
      "stage": "铺垫",
      "block_range": [
        0,
        60
      ],
      "edge_density": 1.0,
      "node_count": 3,
      "edge_count": 3
    },
    {
      "stage": "发展",
      "block_range": [
        61,
        70
      ],
      "edge_density": 1.0,
      "node_count": 2,
      "edge_count": 1
    },
    {
      "stage": "冲突",
      "block_range": [
        71,
        75
      ],
      "edge_density": 1.0,
      "node_count": 2,
      "edge_count": 1
    },
    {
      "stage": "高潮",
      "block_range": [
        76,
        121
      ],
      "edge_density": 1.0,
      "node_count": 3,
      "edge_count": 3
    },
    {
      "stage": "结局",
      "block_range": [
        122,
        241
      ],
      "edge_density": 1.0,
      "node_count": 3,
      "edge_count": 3
    }
  ]
}
