{
  "script_id": "01001014",
  "title": "七星灯",
  "correlations": [
    {
      "type": "character_theme",
      "strength": 1.0,
      "character_id": "c_诸葛亮",
      "character_name": "诸葛亮",
      "topic_id": 0,
      "topic_label": "让位归降",
      "evidence": "诸葛亮 台词与主题「让位归降」关键词重合度较高"
    },
    {
      "type": "character_theme",
      "strength": 1.0,
      "character_id": "c_众将",
      "character_name": "众将",
      "topic_id": 0,
      "topic_label": "让位归降",
      "evidence": "众将 台词与主题「让位归降」关键词重合度较高"
    },
    {
      "type": "character_theme",
      "strength": 1.0,
      "character_id": "c_王平",
      "character_name": "王平",
      "topic_id": 0,
      "topic_label": "让位归降",
      "evidence": "王平 台词与主题「让位归降」关键词重合度较高"
    },
    {
      "type": "character_theme",
      "strength": 1.0,
      "character_id": "c_杨仪",
      "character_name": "杨仪",
      "topic_id": 0,
      "topic_label": "让位归降",
      "evidence": "杨仪 台词与主题「让位归降」关键词重合度较高"
    },
    {
      "type": "character_theme",
      "strength": 1.0,
      "character_id": "c_马岱",
      "character_name": "马岱",
      "topic_id": 0,
      "topic_label": "让位归降",
      "evidence": "马岱 台词与主题「让位归降」关键词重合度较高"
    },
    {
      "type": "character_theme",
      "strength": 1.0,
      "character_id": "c_报子",
      "character_name": "报子",
      "topic_id": 0,
      "topic_label": "让位归降",
      "evidence": "报子 台词与主题「让位归降」关键词重合度较高"
    },
    {
      "type": "character_theme",
      "strength": 0.733,
      "character_id": "c_姜维",
      "character_name": "姜维",
      "topic_id": 0,
      "topic_label": "让位归降",
      "evidence": "姜维 台词与主题「让位归降」关键词重合度较高"
    },
    {
      "type": "character_theme",
      "strength": 0.467,
      "character_id": "c_李福",
      "character_name": "李福",
      "topic_id": 0,
      "topic_label": "让位归降",
      "evidence": "李福 台词与主题「让位归降」关键词重合度较高"
    },
    {
      "type": "network_stage",
      "strength": 1.0,
      "stage": "发展",
      "edge_density_delta": -0.3333,
      "evidence": "「发展」阶段人物同场网络密度变化 -0.33"
    },
    {
      "type": "network_stage",
      "strength": 1.0,
      "stage": "冲突",
      "edge_density_delta": 0.3333,
      "evidence": "「冲突」阶段人物同场网络密度变化 +0.33"
    },
    {
      "type": "network_stage",
      "strength": 1.0,
      "stage": "结局",
      "edge_density_delta": -0.4286,
      "evidence": "「结局」阶段人物同场网络密度变化 -0.43"
    },
    {
      "type": "theme_narrative",
      "strength": 1.0,
      "topic_id": 0,
      "topic_label": "让位归降",
      "stage": "冲突",
      "evidence": "「冲突」段与全剧主导主题「让位归降」相对应"
    },
    {
      "type": "hangdang_narrative",
      "strength": 0.6,
      "hangdang": "老生",
      "peak_block_index": 0,
      "evidence": "老生 行当在 block 0 附近情感强度较高"
    },
    {
      "type": "character_network",
      "strength": 0.7,
      "character_id": "c_姜维",
      "character_name": "姜维",
      "evidence": "姜维 为关系网络核心（度=9）"
    }
  ],
  "summary_insights": [
    "《七星灯》共 11 位主要人物、32 条关系边，网络密度 0.58。",
    "主题构成以「让位归降」为主。",
    "叙事划分为 5 个阶段，高潮位于 block [188, 263]。",
    "诸葛亮 与主题「让位归降」关联最强（1.0）。",
    "行当以老生为主（8 人）。"
  ],
  "character_topic_matrix": [
    {
      "character_id": "c_诸葛亮",
      "character_name": "诸葛亮",
      "topic_id": 0,
      "topic_label": "让位归降",
      "strength": 1.0
    },
    {
      "character_id": "c_众将",
      "character_name": "众将",
      "topic_id": 0,
      "topic_label": "让位归降",
      "strength": 1.0
    },
    {
      "character_id": "c_王平",
      "character_name": "王平",
      "topic_id": 0,
      "topic_label": "让位归降",
      "strength": 1.0
    },
    {
      "character_id": "c_杨仪",
      "character_name": "杨仪",
      "topic_id": 0,
      "topic_label": "让位归降",
      "strength": 1.0
    },
    {
      "character_id": "c_马岱",
      "character_name": "马岱",
      "topic_id": 0,
      "topic_label": "让位归降",
      "strength": 1.0
    },
    {
      "character_id": "c_报子",
      "character_name": "报子",
      "topic_id": 0,
      "topic_label": "让位归降",
      "strength": 1.0
    },
    {
      "character_id": "c_姜维",
      "character_name": "姜维",
      "topic_id": 0,
      "topic_label": "让位归降",
      "strength": 0.733
    },
    {
      "character_id": "c_李福",
      "character_name": "李福",
      "topic_id": 0,
      "topic_label": "让位归降",
      "strength": 0.467
    },
    {
      "character_id": "c_司马懿",
      "character_name": "司马懿",
      "topic_id": 0,
      "topic_label": "让位归降",
      "strength": 0.267
    },
    {
      "character_id": "c_旗牌",
      "character_name": "旗牌",
      "topic_id": 0,
      "topic_label": "让位归降",
      "strength": 0.267
    },
    {
      "character_id": "c_魏延",
      "character_name": "魏延",
      "topic_id": 0,
      "topic_label": "让位归降",
      "strength": 0.267
    }
  ],
  "stage_network_snapshots": [
    {
      "stage": "铺垫",
      "block_range": [
        0,
        59
      ],
      "edge_density": 1.0,
      "node_count": 4,
      "edge_count": 6
    },
    {
      "stage": "发展",
      "block_range": [
        60,
        128
      ],
      "edge_density": 0.6667,
      "node_count": 4,
      "edge_count": 4
    },
    {
      "stage": "冲突",
      "block_range": [
        129,
        187
      ],
      "edge_density": 1.0,
      "node_count": 4,
      "edge_count": 6
    },
    {
      "stage": "高潮",
      "block_range": [
        188,
        263
      ],
      "edge_density": 1.0,
      "node_count": 5,
      "edge_count": 10
    },
    {
      "stage": "结局",
      "block_range": [
        264,
        318
      ],
      "edge_density": 0.5714,
      "node_count": 7,
      "edge_count": 12
    }
  ]
}
